{
  "schemaVersion": "1.1.0",
  "bankId": "argentina-b1",
  "title": "Test de conducir Argentina: práctica general",
  "coverage": "50 preguntas originales de práctica general para autos. Marco nacional de referencia; no es un banco oficial ni cubre todo el temario de B1.",
  "scopeKind": "national-framework",
  "scopeNote": "La Ley 24.449 establece su ámbito de aplicación y admite adhesión y disposiciones locales. Este banco no certifica equivalencia con todos los exámenes provinciales o municipales.",
  "questions": [
    {
      "id": "argentina-b1-001",
      "jurisdictionId": "ar-nacional",
      "licenseClasses": [
        "B1"
      ],
      "topic": "marco-y-requisitos",
      "prompt": "Un agente de tránsito te indica detenerte aunque el semáforo esté en verde. Según la Ley 24.449, ¿qué indicación debés respetar primero?",
      "options": [
        {
          "id": "argentina-b1-001-o1",
          "text": "La luz verde, porque siempre prevalece."
        },
        {
          "id": "argentina-b1-001-o2",
          "text": "La del agente que dirige el tránsito."
        },
        {
          "id": "argentina-b1-001-o3",
          "text": "La maniobra del vehículo que circula adelante."
        }
      ],
      "correctOptionId": "argentina-b1-001-o2",
      "explanation": "El artículo 36 establece este orden: indicaciones de la autoridad, señales de tránsito y normas legales. La luz verde no permite ignorar al agente.",
      "imageId": null,
      "sources": [
        {
          "sourceId": "ar-ley-24449",
          "locator": "Artículo 36"
        }
      ],
      "contentStatus": "source-checked-draft",
      "sourceCheckedAt": "2026-10-21",
      "humanReviewedAt": null,
      "humanReviewer": null,
      "authorship": "original-editorial",
      "version": 1,
      "scopeKind": "national-framework",
      "scopeNote": "Pregunta sobre el marco nacional citado. Complementá con la normativa y el material de tu jurisdicción."
    },
    {
      "id": "argentina-b1-002",
      "jurisdictionId": "ar-nacional",
      "licenseClasses": [
        "B1"
      ],
      "topic": "marco-y-requisitos",
      "prompt": "Antes de salir a la vía pública con un auto, ¿qué debés comprobar según la Ley 24.449?",
      "options": [
        {
          "id": "argentina-b1-002-o1",
          "text": "Que tanto vos como el vehículo estén en condiciones adecuadas de seguridad."
        },
        {
          "id": "argentina-b1-002-o2",
          "text": "Únicamente que haya combustible suficiente."
        },
        {
          "id": "argentina-b1-002-o3",
          "text": "Solo que las luces delanteras enciendan."
        }
      ],
      "correctOptionId": "argentina-b1-002-o1",
      "explanation": "La revisión previa incluye las condiciones del conductor y del vehículo. Poder poner en marcha el motor no demuestra que el conjunto sea seguro.",
      "imageId": null,
      "sources": [
        {
          "sourceId": "ar-ley-24449",
          "locator": "Artículo 39 a"
        }
      ],
      "contentStatus": "source-checked-draft",
      "sourceCheckedAt": "2026-10-21",
      "humanReviewedAt": null,
      "humanReviewer": null,
      "authorship": "original-editorial",
      "version": 1,
      "scopeKind": "national-framework",
      "scopeNote": "Pregunta sobre el marco nacional citado. Complementá con la normativa y el material de tu jurisdicción."
    },
    {
      "id": "argentina-b1-003",
      "jurisdictionId": "ar-nacional",
      "licenseClasses": [
        "B1"
      ],
      "topic": "marco-y-requisitos",
      "prompt": "Según la Ley 24.449, ¿alcanza con tener una licencia de cualquier clase para manejar un automóvil?",
      "options": [
        {
          "id": "argentina-b1-003-o1",
          "text": "Sí, si la licencia todavía no venció."
        },
        {
          "id": "argentina-b1-003-o2",
          "text": "No; necesitás la habilitación correspondiente al tipo de vehículo."
        },
        {
          "id": "argentina-b1-003-o3",
          "text": "Sí, si el titular del auto viaja como acompañante."
        }
      ],
      "correctOptionId": "argentina-b1-003-o2",
      "explanation": "La habilitación debe corresponder al vehículo conducido. La presencia de su dueño no reemplaza esa autorización.",
      "imageId": null,
      "sources": [
        {
          "sourceId": "ar-ley-24449",
          "locator": "Artículo 40 a"
        }
      ],
      "contentStatus": "source-checked-draft",
      "sourceCheckedAt": "2026-10-21",
      "humanReviewedAt": null,
      "humanReviewer": null,
      "authorship": "original-editorial",
      "version": 1,
      "scopeKind": "national-framework",
      "scopeNote": "Pregunta sobre el marco nacional citado. Complementá con la normativa y el material de tu jurisdicción."
    },
    {
      "id": "argentina-b1-004",
      "jurisdictionId": "ar-nacional",
      "licenseClasses": [
        "B1"
      ],
      "topic": "marco-y-requisitos",
      "prompt": "¿En qué formatos permite la Ley 24.449 exhibir el comprobante de seguro vigente?",
      "options": [
        {
          "id": "argentina-b1-004-o1",
          "text": "Solo en una impresión en color."
        },
        {
          "id": "argentina-b1-004-o2",
          "text": "Solo mediante el contrato original firmado por la aseguradora."
        },
        {
          "id": "argentina-b1-004-o3",
          "text": "En papel impreso o en formato digital mediante un dispositivo electrónico."
        }
      ],
      "correctOptionId": "argentina-b1-004-o3",
      "explanation": "El artículo 40 admite ambos formatos. La pregunta se refiere al comprobante de un seguro vigente, no a cualquier archivo o fotografía sin respaldo.",
      "imageId": null,
      "sources": [
        {
          "sourceId": "ar-ley-24449",
          "locator": "Artículo 40 c"
        }
      ],
      "contentStatus": "source-checked-draft",
      "sourceCheckedAt": "2026-10-21",
      "humanReviewedAt": null,
      "humanReviewer": null,
      "authorship": "original-editorial",
      "version": 1,
      "scopeKind": "national-framework",
      "scopeNote": "Pregunta sobre el marco nacional citado. Complementá con la normativa y el material de tu jurisdicción."
    },
    {
      "id": "argentina-b1-005",
      "jurisdictionId": "ar-nacional",
      "licenseClasses": [
        "B1"
      ],
      "topic": "marco-y-requisitos",
      "prompt": "Según la Ley 24.449, ¿cómo deben encontrarse las patentes del vehículo para circular?",
      "options": [
        {
          "id": "argentina-b1-005-o1",
          "text": "Colocadas en los lugares reglamentarios, legibles y sin aditamentos."
        },
        {
          "id": "argentina-b1-005-o2",
          "text": "Guardadas dentro del auto para evitar su deterioro."
        },
        {
          "id": "argentina-b1-005-o3",
          "text": "Parcialmente cubiertas, siempre que se vea la última cifra."
        }
      ],
      "correctOptionId": "argentina-b1-005-o1",
      "explanation": "La identificación de dominio debe poder leerse y cumplir las características reglamentarias. Llevar las placas sueltas dentro del habitáculo no cumple esa exigencia.",
      "imageId": null,
      "sources": [
        {
          "sourceId": "ar-ley-24449",
          "locator": "Artículo 40 d"
        }
      ],
      "contentStatus": "source-checked-draft",
      "sourceCheckedAt": "2026-10-21",
      "humanReviewedAt": null,
      "humanReviewer": null,
      "authorship": "original-editorial",
      "version": 1,
      "scopeKind": "national-framework",
      "scopeNote": "Pregunta sobre el marco nacional citado. Complementá con la normativa y el material de tu jurisdicción."
    },
    {
      "id": "argentina-b1-006",
      "jurisdictionId": "ar-nacional",
      "licenseClasses": [
        "B1"
      ],
      "topic": "marco-y-requisitos",
      "prompt": "¿Qué elementos exige la Ley 24.449 para circular en automóvil ante una eventual emergencia?",
      "options": [
        {
          "id": "argentina-b1-006-o1",
          "text": "Solo una linterna y un chaleco de cualquier tipo."
        },
        {
          "id": "argentina-b1-006-o2",
          "text": "Matafuego y balizas portátiles normalizados."
        },
        {
          "id": "argentina-b1-006-o3",
          "text": "Únicamente las balizas eléctricas del vehículo."
        }
      ],
      "correctOptionId": "argentina-b1-006-o2",
      "explanation": "El artículo 40 exige matafuego y balizas portátiles normalizados. Las luces intermitentes del auto no sustituyen las balizas portátiles.",
      "imageId": null,
      "sources": [
        {
          "sourceId": "ar-ley-24449",
          "locator": "Artículo 40 f"
        }
      ],
      "contentStatus": "source-checked-draft",
      "sourceCheckedAt": "2026-10-21",
      "humanReviewedAt": null,
      "humanReviewer": null,
      "authorship": "original-editorial",
      "version": 1,
      "scopeKind": "national-framework",
      "scopeNote": "Pregunta sobre el marco nacional citado. Complementá con la normativa y el material de tu jurisdicción."
    },
    {
      "id": "argentina-b1-007",
      "jurisdictionId": "ar-nacional",
      "licenseClasses": [
        "B1"
      ],
      "topic": "marco-y-requisitos",
      "prompt": "Un auto tiene capacidad para cinco personas. Según la Ley 24.449, ¿podrían viajar seis si el recorrido es corto?",
      "options": [
        {
          "id": "argentina-b1-007-o1",
          "text": "Sí, si una persona viaja sobre las piernas de otra."
        },
        {
          "id": "argentina-b1-007-o2",
          "text": "Sí, si no se circula por una ruta."
        },
        {
          "id": "argentina-b1-007-o3",
          "text": "No; la cantidad de ocupantes debe respetar la capacidad del vehículo."
        }
      ],
      "correctOptionId": "argentina-b1-007-o3",